470,Saw IV,Horror,Darren Lynn Bousman,"Tobin Bell, Shawnee Smith",2007-10-26,10,92,139.4
471,Saw V ,Horror,David Hacki ,"Tobin Bell, Costas Mandylor ",2008-10-24,10.8,92,118.2
472,Saw VI,Horror,Kevin Greutert ,"Tobin Bell, Costas Mandylor ",2009-10-23,11,90,69.8
473,Saw 3D,Horror,Kevin Greutert ,"Tobin Bell, Costas Mandylor ",2010-10-29,17,90,136.2
474,Jigsaw,Horror ,The Spiering Brothers,"Matt Passmore, Callum Keith Rennie ",2017-10-27,10,92,104.2
475,Spiral ,Horror/Thriller,Darren Lynn Bousman,"Chris Rock, Max Minghella ",2021-05-14,20,93,40.6
476,Saw X,Horror,Kevin Greutert ,"Tobin Bell, Shawnee Smith",2023-09-29,13,118,125.3
477,Red Dragon ,Psychological/Thriller,Brett Ratner ,"Anthony Hopkins, Edward Norton",2002-10-04,78,124,209.2
478,Hannibal Rising ,Psychological/Horror/Thriller,Peter Webber,"Gaspard Ulliel, Gong Li",2007-02-22,75,121,82.1
479,Scream ,Slasher ,Wes Craven ,"David Arquette, Neve Campbell ",1996-12-20,14,111,173
480,Scream 2,Slasher ,Wes Craven ,"David Arquette, Neve Campbell ",1997-12-12,24,120,172
481,Scream 3,Slasher ,Wes Craven ,"David Arquette, Neve Campbell ",2000-02-04,40,117,161.8
482,Scream 4,Slasher ,Wes Craven ,"David Arquette, Neve Campbell ",2011-04-15,40,111,97.2
483,Scream (2022 film),Slasher ,Matt Bettinelli-Olpin,"Melissa Barrera, Neve Campbell",2022-01-14,24,114,138.9
484,Scream VI,Slasher ,Matt Bettinelli-Olpin,"Melissa Barrera, Jasmin Savoy Brown",2023-03-10,33,122,169
485,Scary Movie 2,Supernatural/Parody,Kennen Ivory Wayans,"Shawn Wayans, Marlon Wayans",2001-07-04,45,82,141.2
486,Scary Movie 4,Parody ,David Zucker,"Anna Faris, Regina Hall",2006-04-14,40,83,178.3
487,Scary Movie 5,Parody ,Malcolm D.Lee,"Ashley Tisdale, Simon Rex",2013-04-12,20,86,78.4
488,Paranormal Activity 2,Supernatural/Horror,Tod Williams,"Sprague Grayden, Brain Boland",2010-10-22,3,91,177.5
489,Paranormal Activity 4,Supernatural/Horror,"Henry Joost, Ariel Schulman","Kathryn Newton, Matt Shively ",2012-10-19,5,88,142.8
490,Paranormal Activity: The Marked Ones,Supernatural/Horror,Christopher Landon,"Jorge Diaz, Andrew Jacobs",2014-01-03,5,24,90.9
491,Paranormal Activity: The Ghost Dimension,Supernatural/Horror,Gregory Plotkin,"Chris J. Murray, Brittany Shaw ",2015-10-23,10,88,78.9
492,Paranormal Activity: Next of Kin,Supernatural/Horror,William Eubank,"Emily Bader, Roland Buck III",2021-10-29,0.015,98,194
493,Halloween: Resurrection,Slasher,Rick Rosenthal ,"Busta Rhymes, Bianca Kajlich ",2002-07-12,15,90,37.6
494,Halloween (2007),Slasher,Rob Zombie ,"Malcolm McDowell, Sheri Moon Zombie ",2007-08-31,15,110,80.4
495,Halloween II,Slasher,Rob Zombie ,"Malcolm McDowell, Sheri Moon Zombie ",2009-08-28,15,105,39.4
496,Halloween Kills ,Slasher ,David Gordon Green ,"Jamie Lee Curtis, Judy Greer",2021-10-15,20,105,133.4
497,Halloween Ends,Slasher,David Gordon Green ,"Jamie Lee Curtis, Andi Matichak ",2022-10-11,33,111,105.4
498,Predators,Sc-Fi/Action,Nimrod Antal,"Adrien Brody, Topher Grace",2010-10-09,40,107,127.2
499,The Predator,Sc-Fi/Action,Shane Black ,"Boyd Holbrook, Olivia  Munn",2018-09-14,88,108,160.5
500,Insidious: The Red Door,Supernatural/Horror,Patrick Wilson,"Ty Simpkins, Rose Byrne",2023-07-07,16,107,189.1
