240,The Boy and The Heron,Animation/Fantasy ,Hayao Miyazaki,"Soma Santoki, Masaki Suda ",2023-07-14,53,124,294.2
241,The Princes and the Frog,Animation/Romantic/Fantasy ,"John Musker, Ron Clements","Anika Noni Rose, Bruno Campos",2009-12-11,105,97,271
242,One Piece Film:Red,Animation/Adventure/Fantasy ,Goro Taniguchi,"Mayumi Tanaka, Shuichi Ikeda ",2022-08-06,5,115,246.5
243,Ponyo ,Animation/Fantasy ,Hayao Miyazaki,"Tomoko Yamaguchi, Kazushige Nagashima ",2008-07-19,34,101,205.9
244,Jujutsu Kaisen 0,Animation/Fantasy ,Sunghoo Park,"Megumi Ogata, Kana Hanazawa ",2021-12-24,15.8,105,196.2
245,Weathering with you ,Animation/Romantic/Fantasy ,Makoto Shinkai ,"Kotaro Daigo, Nana Mori",2019-07-19,11,112,193.8
246,Titanic ,Romantic/Disaster ,James Cameron ,"Leonardo DiCaprio, Kate Winslet ",1997-12-19,200,195,2264
247,Star Wars:The Force Awakens,Space/Opera ,J. J. Abrams ,"Harrison Ford, Mark Hamill ",2015-12-18,447,138,2071
248,Jurassic World ,Sc-Fi/Action,Colin Trevorrow ,"Chris Pratt, Byrce Dallas Howard ",2015-06-12,150,124,1671
249,Furious 7,Action ,James Wan ,"Vin Diesel, Paul Walker",2015-04-03,190,137,1515
250,Star Wars:The Last Jedi ,Space/Opera ,Rian Johnson ,"Mark Hamill, Carrie Fisher ",2017-12-15,300,152,1334
251,Jurassic World:Fallen Kingdom,Sc-Fi/Action,J.A. Bayona,"Chris Pratt, Bryce Dallas Howard ",2018-06-22,432,128,1310
252,Beauty and The Beast ,Romantic/Fantasy,Bill Condon ,"Emma Watson, Dan Stevens ",2017-03-17,160,129,1266
253,The Fate Of The Furious ,Action ,F. Gary Gray ,"Vin Diesel, Dwayne Johnson ",2017-04-14,250,136,1236
254,SkyFall,Spy/Action,Sam Mendes ,"Daniel Craig, Javier Barden ",2012-10-26,150,143,1109
255,The Dark Knight Rise ,Superhero ,Christoher Nolan ,"Christian Bale, Michael Caine ",2012-07-20,250,164,1085
256,Joker ,Psychological /Thriller ,Todd Phillips,"Joaquin Phoenix, Robert De Niro ",2019-10-04,55,122,1079
257,Star Wars:The Rise Of Skywalker,Space/Opera ,J. J. Abrams ,"Carrie Fisher, Mark Hamill",2019-12-20,416,142,1077
258,Priate of the Caribbean:Dead Man's Chest,Fantasy/Swashbuckler,Gore Verbinski ,"Johnny Depp, Orlando Bloom ",2006-07-07,225,151,1066
259,Rogue One ,Space/Opera ,Gareth Edwards ,"Felicity Jones, Diego Luna ",2016-12-16,200,134,1059
260,Aladdin ,Musical/Fantasy,Guy Ritchie ,"Will Smith, Mena Massound ",2019-05-24,183,128,1054
261,Star Wars:Episode I -The Phantom Menace ,Space/Opera ,George Lucas ,"Liam  Neeson, Ewan McGregor ",1999-05-19,115,134,1046
262,Priate of the Caribbean:On Stranger Tides,Fantasy/Swashbuckler,Rob Marshall,"Johnny Depp, Penelope Cruz",2011-05-20,410.6,137,1046
263,Jurassic Park ,Sc-Fi/Action,Steven Spielberg ,"Sam Neill, Laura Dern",1993-06-11,63,127,1058
264,Alice in Wonderland ,Adventure/Fantasy ,Tim Burton ,"Johnny Depp, Anee Hathaway ",2010-03-05,150,108,1025
265,The Dark Knight ,Superhero ,Christopher Nolan,"Christian Bale, Michael Caine ",2008-07-25,185,152,1006
266,Missionn:Impossible2,Spy/Action,John Woo,"Tom Cruise, Paula Wagner ",2000-05-24,120,124,546.3
267,Pirates of the Caribbean:At World's End ,Fantasy/Swashbuckler,Gore Verbinski ,"Johnny Deep, Orlando Bloom ",2007-05-25,300,168,963.4
268,Gone with the Wind ,Historical/Romance ,Victor Fleming ,"Clark Gable, Vivien Leigh ",1939-12-15,3.85,221,390
269,Star Wars ,Space/Opera,George Lucas ,"Mark Hamill, Carrie Fisher ",1977-05-25,11,121,775.4
270,The Sound of Music ,Musical/Drama,Robert Wise,"Julie Andrews, Christopher Plummer ",1965-03-02,8.2,174,286.2
271,E.T. the Extra-Terrestrial,Sc-Fi,Steven Spielberg ,"Dee Wallace, Henry Thomas ",1982-06-11,10.5,114,792.9
272,The Ten Commandments,Religious/Drama,Cecil B.DeMille ,"Charlton Heston, Yul Brynner ",1956-11-08,13,220,122.7
273,Doctor Zhivago ,Historical/Romance ,David Lean ,"Geraldine Chaplin, Julie Christie ",1992-12-22,11,200,248.2
274,Spider-Man ,Superhero ,Sam Raimi ,"Tobey Maguire, Willem Dafoe ",2002-05-03,139,121,831.2
275,Spider-Man 2,Superhero ,Sam Raimi ,"Tobey Maguire, Willem Dafoe ",2004-06-30,200,127,795.9
276,Spider-Man 3,Superhero ,Sam Raimi ,"Tobey Maguire, Willem Dafoe ",2007-05-04,258,139,890.9
277,The Amazing Spider-Man ,Superhero ,Marc Webb,"Andrew Garfield, Emma Stone ",2012-07-03,200,136,758
278,The Amazing Spider-Man 2,Superhero ,Marc Webb,"Andrew Garfield, Emma Stone ",2014-05-02,200,142,709
279,Spider-Man: Into the Spider-Verse ,Animation/Superhero,"Bob Persichetti, Peter Ramsey, Rodney Rothman ","Shameik Moore, Jake Johnson",2018-12-14,90,117,384.3
280,The Empire Strikes Back ,Space/Opera ,Irvin Kershner ,"Mark Hamill, Carrie Fisher ",1980-05-21,30.5,124,538
281,Return of the Jedi ,Space/Opera ,Richard Marquand,"Mark Hamill, Carrie Fisher ",1983-05-25,32.5,132,482
282,Star Wars:Episode II-Attack of the Clones ,Space/Opera ,George Lucas ,"Ewan McGregor, Natalie Portman ",2002-05-16,115,142,653.8
283,Star Wars:Episode III-Revenge of the Sith,Space/Opera ,George Lucas ,"Ewan McGregor, Natalie Portman ",2005-05-16,113,140,868.4
284,Solo:A Star Wars Story ,Space/Western,Ron Howard ,"Alden Ehrenreich, Woody Harrelson ",2018-05-25,275,135,393.2
285,Die Another Day ,Spy,Lee Tamahori ,"Pierce Brosnan, Halle Berry",2002-11-22,142,133,431.9
286,Casino Royale ,Spy/Action/Thriller ,Martin Campbell,"Daniel Craig, Eva Green ",2002-11-17,102,144,616
287,Quantum of Solace ,Spy,Marc Forster ,"Daniel Craig, Olga Kurylenko",2008-11-14,200,106,589.6
288,Spectre ,Spy,Sam Mendes ,"Daniel Craig, Christoph Waltz",2015-11-06,245,148,880.7
289,No Time To Die ,Spy,Cary Joji Fukunaga ,"Daniel Craig, Rami Malek ",2021-10-08,250,163,774.2
290,X-Men,Superhero ,Bryan Singer ,"Patrick Stewart, Hugh Jackman ",2000-07-14,75,104,296.3
291,X2,Superhero ,Bryan Singer ,"Patrick Stewart, Hugh Jackman ",2003-05-02,110,134,407.7
292,X-Men:The Last Stand ,Superhero ,Brett Ratner ,"Hugh Jackman, Halle Berry",2006-05-26,210,104,460.4
293,X-Men Origins: Wolverine ,Superhero ,Gavin Hood ,"Hugh Jackman, Danny Huston ",2009-05-01,150,107,373
294,The Wolverine ,Superhero ,James Mangold ,"Hugh Jackman, Hiroyuki Sanada ",2013-07-26,100,126,414.8
295,Logan,Superhero ,James Mangold ,"Hugh Jackman, Patrick Stewart ",2017-05-03,97,137,619.2
296,X-Men :First Class ,Superhero ,Matthew Vaughn ,"James McAvoy, Michael Fassbender ",2011-06-03,140,132,353
297,X-Men:Days of Future Past,Superhero ,Bryan Singer ,"Hugh Jackman, James McAvoy",2014-05-10,200,132,746
298,X-Men:Apoxalypse ,Superhero ,Bryan Singer ,"James McAvoy, Michael Fassbender ",2016-05-27,178,144,543.9
299,Dark Phoenix ,Superhero ,Simon Kinberg,"James McAvoy, Michael Fassbender ",2019-06-07,200,114,252.4
300,Deadpool ,Superhero ,Tim Miller ,"Ryan Reynolds, Morena Baccarin",2016-02-12,58,108,782
301,Deadpool 2,Superhero ,David Leitch ,"Ryan Reynolds, Josh Brolin",2018-05-18,110,119,785
302,The New Mutants ,Superhero ,Josh Boone ,"Maisie Williams, Anya Taylor-Joy",2020-08-28,67,94,49.2
303,The Fast and the Furious ,Action ,Rob Cohen ,"Vin Diesel, Paul Walker",2001-06-22,38,106,207.3
304,2 Fast 2 Furious ,Action ,John Singleton ,"Paul Walker, Tyrese Gibson ",2003-06-06,76,108,236.4
305,The Fast and the Furious:Tokyo Drift ,Action ,Justin Lin ,"Lucas Black, Bow Wow ",2006-06-16,85,104,159
306,Fast & Furious ,Action ,Justin Lin ,"Vin Diesel, Paul Walker",2009-04-03,85,107,360.4
307,Fast Five ,Action ,Justin Lin ,"Vin Diesel, Paul Walker",2011-04-29,125,130,626.1
308,Fast & Furious 6,Action ,Justin Lin ,"Vin Diesel, Paul Walker ",2013-04-24,160,130,788.7
309,F9,Action ,Justin Lin ,"Vin Diesel, Michelle Rodriguez",2021-06-25,200,143,726.2
310,Batman:Return of the Caped ,Animation/Superhero,Rick Morales ,"Adam West, Burt Ward ",2016-10-10,3.5,78,0.057
311,Batman vs. Two-Face ,Animation/Superhero,Rick Morales ,"Adam West, Burt Ward ",2017-10-10,1,72,1.1
312,Batman:The Killing Joke ,Adult/Animation/Superhero,Sam Liu,"Kevin Conroy, Mark Hamill ",2016-07-25,3.5,77,4.4
313,The Lego Batman Movie ,Animation/Superhero/Comedy,Chris Mckey,"Will Arnett, Zach Galigianakis ",2017-03-30,80,104,312.2
314,Batman Begins ,Superhero ,Christoper Nolan,"Christian Bale, Michael Caine ",2005-06-17,150,140,373.7
315,Joker: Folie `a Deux,Psychological/Thriller/Musical,Todd Phillips,"Joaquin Phoenix, Lady Gaga",2024-10-04,200,138,204.8
316,The Batman,Superhero,Matt Reeves,"Robert Pattinson, Zoe Kravitz",2022-10-04,185,176,772.3
317,The Lost World:Jurassic Park ,Sc-Fi/Fiction/Action,Steven Spielberg ,"Jeff Goldblum, Julianne Moore ",1997-05-23,73,129,618.6
318,Jurassic Park III,Sc-Fi/Fiction/Action,Joe Johnston,"Sam Neill, William H.Macy ",2001-07-18,93,92,368.8
319,Jurassic World Dominion ,Sc-Fi/Fiction/Action,Colin Trevorrow ,"Chris Pratt, Byrce Dallas Howard ",2022-06-10,265,160,1400
320,The Lord of The Rings ,Animation/Fantasy,Ralph Bakshi ,"Christopher Guard, William Squire ",1979-07-05,4,133,32.6
321,The Hobbit: An Unexpected Journey ,Fantasy/Adventure ,Peter Jackson,"Ian Mckellen, Martin Freeman ",2012-12-14,200,169,1017
322,The Hobbit:The Desolation of Smaug ,Fantasy/Adventure ,Peter Jackson,"Ian Mckellen, Martin Freeman ",2013-12-13,217,161,959
323,The Hobbit:The Battle of the Five Armies ,Fantsy/Adventure ,Peter Jackson,"Ian Mckellen, Martin Freeman ",2014-12-17,209,144,962.2
324,Despicable Me 4,Animation/Comedy,Chris Renaud ,"Steve Carell, Kristen Wiig",2024-07-03,100,95,968.3
325,Pirates of the Caribbean:The Curse of the Black Pearl,Fantasy/Swashbuckler,Gore Verbinski ,"Johnny Depp, Geoffrey Rush ",2003-07-09,140,143,654.3
326,Pirates of the Caribbean:Dead Men Tell No Tales ,Fantasy/Swashbuckler,Joachim Ronning ,"Johnny Depp, Javier Bardem ",2017-05-26,230,129,795.9
327,Mission:Impossible ,Action/Spy ,Brian De Palma ,"Tom Cruise, Jon Voight ",1996-05-22,80,110,457.7
328,Mission:Impossible III,Action/Spy ,J. J. Abrams ,"Tom Cruise, Philip Seymour Hoffman ",2006-05-05,150,126,399.4
329,Mission:Impossible-Ghost Protocol,Action/Spy ,Brad Bird ,"Tom Cruise, Jeremy Renner ",2011-12-16,145,133,694.7
330,Mission:Impossible-Rogue Nation ,Action/Spy ,Christopher McQuarrie ,"Tom Cruise, Jeremy Renner ",2015-07-31,150,131,688.9
331,Mission:Impossible-Fallout ,Action/Spy ,Christopher McQuarrie ,"Tom Cruise, Henry Cavill",2018-07-27,178,147,791.1
332,Shrek ,Fantasy/Comedy,"Andrew Adamson, Vicky Jenson ","Mike Myers, Eddie Murphy ",2001-05-18,60,90,492.2
333,Puss in Boots:The Last Wish,Animation/Adventure/Comedy,Joel Crawford,"Antonio Banderas, Salma Hayek",2022-12-21,90,102,485.3
334,The Hunger Games ,Dystopian/Action ,Gary Ross,"Jennifer Lawrence, Josh Hutcherson",2012-12-23,78,142,695.2
335,The Hunger Games:Catching Fire ,Dystopian/Action ,Francis Lawrence ,"Jennifer Lawrence, Josh Hutcherson",2013-11-22,130,146,865
336,The Hunger Games:Mockingjay-Part 1,Dystopian/Action ,Francis Lawrence ,"Jennifer Lawrence, Josh Hutcherson",2014-11-21,125,123,755.4
337,The Hunger Games:Mockingjay-Part 2,Dystopian/Action ,Francis Lawrence ,"Jennifer Lawrence, Josh Hutcherson",2015-11-20,160,137,661.4
338,The Hunger Games:The Ballad of Songbirds & Snakes,Dystopian/Action ,Francis Lawrence ,"Tom Blyth, Rachel Zegler ",2023-11-17,100,157,348.9
339,Dragon Ball Super:Broly,Animation/Martial Arts/Fantasy ,Tatsuya Nagamine ,"Masako Nozawa, Ryo Horikawa ",2018-12-14,8.5,100,124
340,The Wind Rises ,Animation/Historical/Drama ,Hayao Miyazaki,"Hideaki Anno, Miori Takimoto",2013-07-20,30,126,136.5
341,Atlantis: The Lost Empire ,Animation/Sc-Fi/Fantasy ,"Gary Trousdale, Kirk Wise ","Michael J. Fox, James Garner ",2001-06-15,90,96,186.1
342,The Emperor's New Groove ,Animation/Fantasy/Comedy,Mark Dindal ,"David Spade, John Goodman ",2000-12-15,100,78,169.7
343,Arrietty ,Animation/Fantasy,Hiromasa Yonebayashi ,"Mirai Shida, Ryunosuke Kamiki ",2010-07-17,23,95,146
344,Home on the Range ,Animation/Western/Musical,Will Finn,"Roseanne Barr, Judi Dench ",2004-04-02,110,76,145.3
345,The SpongeBob SquarePants Movie ,Animation/Adventure/Comedy,Stephen Hillenburg,"Tom Kenny, Bill Fagerbakke ",2004-11-19,30,87,141
346,Sprit:Stallion of the Cimarron,Animation/Western,"Kelly Asbury, Lorna Cook","Matt Damon, James Cromwell",2002-05-24,80,83,122.6
347,Sing 2 ,Animation/Jukebox/Musical,Garth Jennings ,"Matthew McConaughey, Reese Witherspoon ",2021-12-22,85,110,408.4
348,Dinosaur ,Animation/Adventure/Live-action,"Ralph Zondag, Eric Leighton","D. B. Sweeney, Alfre Woodard ",2000-05-19,127.5,82,349.8
349,Toy Story ,Animation/Comedy,John Lasseter ,"Tom Hanks, Tim Allen ",1995-11-19,30,81,394.4
350,Toy Story 2,Animation/Comedy/Adventure ,John Lasseter ,"Tom Hanks, Tim Allen ",1999-11-24,90,92,511.4
351,Lightyear ,Animation/Sc-Fi/Action,Angus MacLane,"Chris Evans, Keke Palmer ",2022-06-17,200,105,226.4
352,The Smurfs ,Fantasy/Adventure/Comedy,Raja Gosnell,"Neil Patrick Harris, Jayma Mays",2011-07-29,110,103,563.7
353,Ted ,Fantasy/Adventure/Comedy,Seth MacFarlane ,"Mark Wahlberg, Mila Kunis ",2012-06-29,50,106,549.4
354,Teenage Mutant Ninja Turtles ,Superhero/Comedy ,Jonathan Liebesman ,"Megan Fox, Will Arnett ",2014-08-08,125,101,485
355,Alvin and the Chipmunks:The Squeakquel ,Live-action/Animation/Jukebox,Betty Thomas ,"Zachary Levi, David Cross ",2009-12-23,70,88,443.1
356,Detective Pikachu ,Fantasy ,Rob Letterman,"Ryan Reynolds, Justice Smith ",2019-05-10,150,104,450.1
357,Sonic the Hedgehog 2,Action/Adventure/Conedy,Jeff Fowler ,"Ben Schwartz, James Marsden ",2022-08-19,90,122,405.4
358,Alvin and the Chipmunks ,Live-action/Animation/Jukebox,Tim Hill,"Jason Lee, David Cross",2007-12-14,60,92,361.3
359,Who Framed Roger Rabbit ,Fantasy/Comedy ,Robert Zemeckis ,"Bob Hoskins, Christopher Lloyd ",1988-12-22,50.6,104,351.5
360,Peter Rabbit ,Comedy ,Will Gluck ,"Rose Byrne, Domhnall Gleeson ",2018-03-22,50,95,351.3
361,Mary Poppins Returns,Musical/Fantasy,Rob Marshall,"Emily Blunt, Lin-Manuel Miranda ",2016-12-19,130,131,349.5
362,The Smurfs 2,Fanstasy/Comedy ,Raja Gosnell,"Neil Patrick Harris, Jayma Mays",2013-07-31,105,105,347.5
363,Alvin and the Chipmunks:Chipwrecked ,Live-action/Animation/Jukebox,Mike Mitchell,"Jason Lee, David Cross",2011-12-16,80,87,342.7
364,Enchanted ,Live-action/Animation/Musical ,Kevin Lima ,"Amy Adams, Patrick Dempsey ",2007-11-21,25,107,340.5
365,Sonic the Hedgehog ,Action/Adventure/Comedy,Jeff Fowler ,"James Marsden, Jim Carrey ",2020-06-26,85,99,320
366,Stuart Little ,Live-action/Animation/Comedy,Rob Minkoff,"Geena Davis, Hugh Laurie ",1999-12-17,105,84,300.1
367,G-Force ,Spy/Adventure/Comedy,Hoyt H.Yeatman Jr.,"Bill Nighy, Will Arnett",2009-07-24,150,90,292.8
368,Casper ,Supernatural/Fantasy/Comedy ,Brad Silberling ,"Malachi Pearson, Christina Ricci ",1995-05-26,55,101,288
369,Stuart Little 2,Live-action/Animation/Comedy,Rob Minkoff,"Geena Davis, Hugh Laurie ",2002-07-19,120,78,170
370,Stuart Little 3:Call of the Wild ,Live-action/Animation/Comedy,Audu Paden ,"Michael J. Fox, Geena Davis ",2006-02-21,110,75,180
371,Paddington ,Live-action/Animation/Comedy,Paul King ,"Hugh  Bonneville, Sally Hawkins ",2014-12-03,65,95,282.8
372,Scooby-Doo,Mystery/Adventure ,Raja Gosnell,"Freddie Prinze Jr, Sarah Michelle Gellar ",2002-06-14,84,86,275.7
373,Space Jam ,Live-action/Animation/Comedy,Joe Pytka ,"Michael Jordan, Billy West",1996-11-15,80,88,250.2
374,Teenage Mutant Ninja Turtles:Out of the Shadows ,Superhero/Comedy ,Drave Green ,"Megan Fox, Will Arnett ",2016-05-22,135,112,245.6
375,Alvin and the Chipmunks:The Road Chip,Live-action/Animation/Jukebox,Walt Becker ,"Jason Lee, David Cross",2015-12-18,90,92,234.8
376,Paddington 2,Live-action/Animation/Comedy,Paul King ,"Hugh Bonneville, Sally Hawkins ",2017-12-06,40,104,227.3
377,Ted 2,Fantasy/Comedy,Seth MacFarlane ,"Mark Wahlberg, Seth MacFarlane ",2015-06-26,68,115,215.9
378,Yogi Bear ,Live-action/Animation/Comedy,Eric Brevig ,"Dan Aykroyd, Justin Timberlake ",2010-12-17,80,80,200
379,Garfield:The Movie,Comedy ,Peter Hewitt,"Breckin Meyer, Jennifer Love Hewitt",2004-06-11,50,84,208.1
380,Christopher Robin ,Live-action/Animation/Fantasy,Marc Forster ,"Ewan McGregor, Hayley Atwell",2018-08-03,65,104,197.7
381,The Big ,Fantasy/Adventure ,Steven Spielberg ,"Mark Rylance, Ruby Barnhill",2016-07-22,140,118,195.2
382,IF,Fantasy/Comedy ,John Krasinski ,"Cailey Fleming, Ryan Reynolds",2024-05-17,110,104,190.3
383,Scooby-Doo 2:Monsters Unleashed ,Mystery/Adventure/Comedy,Raja Gosnell,"Freddie Prinze Jr, Sarah Michelle Gellar ",2004-03-26,25,92,181.2
384,Hop,Live-action/Animation/Comedy,Tim Hill,"James Marsden, Russell Brand ",2011-04-01,63,95,183.9
385,Space Jam: A New Legacy ,Live-action/Animation/Sport ,Malcolm D.Lee,"LeBron James, Don Cheadle ",2021-07-16,150,115,163.7
386,Peter Rabbit 2: The Runway ,Adventure/Comedy ,Will Gluck ,"Rose Byrne, Domhnall Gleeson ",2021-06-11,45,93,154
387,Charlotte's Web,Fantasy ,Gary Winick ,"Julia Roberts, Dakota Fanning ",2006-12-15,85,97,150
388,Pete's Dragon ,Fantasy/Adventure,David Lowery ,"Bryce Dallas Howard, Oakes Fegley ",2016-08-12,65,103,143.7
389,Garfield:A Tail of Two Kittties ,Adventure/Comedy ,Tim Hill,"Breckin Meyer, Jennifer Love Hewitt",2006-06-16,60,78,143.3
390,Tom & Jerry ,Live-action/Comedy/Animation ,Tim Story ,"Chloe Grace Moretz, Michael Pena ",2021-02-26,50,101,136
391,Walking with Dinosaurs,Live-action/Animation,"Neil Nightingale, Barry Cook ","John Leguizamo, Justin Long ",2013-12-20,80,87,126.5
392,Dora and the Lost City of Gold ,Adventure/Comedy ,James Bobin ,"Isabela Moner, Eugenio Derbez ",2019-08-09,49,102,120.6
393,The Call of the Wild ,Adventure ,Chris Sanders ,"Harrison Ford, Omar Sy ",2020-02-21,125,100,111.1
394,"Lyle,Lyle, Crocodile ",Live-action/Animation/Comedy,"Will Speck, Josh Gordon ","Javier Bardem, Constance Wu",2022-10-07,50,106,111
395,Arthur and the Minimoys ,Live-action/Animation/Fantasy,Luc Besson ,"Robert De Niro, Madonna ",2006-11-29,63,103,107.9
396,Clifford the Big Red Dog ,Live-action/Animation/Fantasy,Walt Becker ,"Jack Whitehall, Darby Camp",2021-11-10,64,96,107.4
397,Mary Poppins  ,Musical/Fantasy/Comedy,Robert Stevenson ,"Julie Andrews, Dick Van Dyke ",1964-09-24,4.4,139,103.1
398,Cheburashka ,Action/Animation,Dmitry Dyachenko ,"Olga Kuzmina, Sergei Garmash ",2023-01-01,12,113,88.212
399,Arthur and the Revenge of Maltazard ,Live-action/Animation/Fantasy,Luc Besson ,"Freddie Prinze Jr, Selena Gomez ",2009-12-02,43,93,78.5
400,Looney Tunes:Back in Action ,Live-action/Animation/Comedy,Joe Dante ,"Brendan Fraser, Jenna Elfman ",2003-11-14,80,93,68.5
401,Song of the South ,Live-action/Animation/Musical ,"Harve Foster, Wilfred Jackson","Ruth Warrick, Lucile Watson ",1947-01-30,2.1,94,65
402,Monster Trucks ,Live-action/Animation/Comedy,Chris Wedge ,"Lucas Till, Jane Levy",2017-01-13,125,105,64.5
403,Houba! On the Trail of the Marsupilami ,Live-action/Comedy/Animation ,Alain Chabat ,"Alain Chabat, Jamel Debbouze",2012-04-04,41.6,105,51.1
404,Aliens in the Attic ,Sc-Fi/Fiction/Comedy,John Schultz,"Kevin Nealon, Robert Hoffman ",2009-07-31,45,86,59.6
405,The Adventures of Rocky and Bullwinkle ,Live-action/Animation/Adventure,Des McAnuff,"Rene Russo, Jason Alexander ",2000-06-20,76,92,35.1
406,Thomas and the Magic Railroad ,Fantasy/Adventure/Children,Britt Allcroft ,"Peter Fonda, Mara Wilson",2000-07-26,19,84,19.7
407,Woody Woodpecker ,Live-action/Animation ,Alex Zamm,"Eric Bauza, Timothy Omundson ",2018-02-06,10,91,15.3
408,Smurfs: The Lost Village ,Fantasy/Adventure/Comedy,Kelly Asbury,"Demi Lovato, Rainn Wilson ",2017-04-07,60,90,197.2
409,TMNT ,Superhero ,Kevin Munroe,"Chris Evans, Sarah Michelle Gellar",2007-03-23,34,87,95.6
410,Teenage Mutant Ninja Turtles:Mutant Mayhem ,Superhero,Jeff Rowe,"Micah Abbey, Shamon Brown Jr.",2023-08-02,70,99,180.5
411,It,Supernatural/Horror,Andy Muschietti ,"Jaden Lieberher, Bill Skarsgard",2017-09-08,35,135,704.2
412,The Sixth Sense ,Psychological /Thriller,M.Night Shyamalan,"Bruce Willis, Toni Collette",1999-08-06,40,108,672.8
413,I Am Legend ,Post-Apocalyptic/Action/Thriller,Francis Lawrence ,"Will Smith, Alice Braga",2007-12-14,150,101,585
414,World War Z,Action/Horror,Marc Forster ,"Brad Pitt, Dede Gardner ",2013-06-21,190,116,540
415,Jaws,Thriller,Steven Spielberg ,"Roy Scheider, Robert Shaw ",1975-06-20,9,124,476.5
416,It Chapter Two ,Supernatural/Horror,Andy Muschietti ,"James McAvoy, Jessica Chastain",2015-09-06,79,169,473.1
417,Bettlejuice Beetlejuice ,Fantasy/Comedy/Horror,Tim Burton ,"Michael Keaton, Wiona Ryder",2024-09-06,99,104,451.1
418,The Exorcist ,Supernatural/Horror,William Friedkin ,"Ellen Burstyn, Max Von Sydow",1973-12-26,12,122,441.3
419,Signs ,Sc-Fi/Thriller/Horror,M.Night Shyamalan,"Mel Gibson, Joaquin Phoenix",2002-08-02,72,106,408.2
420,Prometheus ,Sc-Fi/Fiction/Horror,Ridley Scott,"Noomi Rapace, Michael Fassbender ",2012-06-08,120,124,403.4
421,The Nun ,Gothic/Supernatural/Horror,Corin Hardy ,"Demian Bichir, Raissa Farmiga ",2018-09-07,22,96,366
422,Hannibal ,Horror,Ridley Scott,"Anthony Hopkins, Julianne Moore ",2001-02-09,87,131,351.6
423,Alien: Romulus ,Sc-Fi/Horror,Fede Alvarez,"Cailee Spaeny, David Jonsson",2024-08-16,80,119,350.9
424,A Quiet Place ,Post-Apocalyptic/Horror,John Krasinski ,"Emily Blunt, John Krasinski",2018-04-06,17,90,341
425,The Conjuring 2 ,Supernatural/Horror,James Wan ,"Vera Farmiga, Patrick Wilson",2016-06-10,40,134,321.8
426,The Conjuring,Supernatural/Horror,James Wan ,"Vera Farmiga, Patrick Wilson",2013-07-19,20,112,319.5
427,Resident Evil: The Final Chapter ,Action/Horror,Paul W. S. Anderson ,"Milla Jovovich, Lain Glen ",2017-02-03,40,106,312.2
428,Annabelle: Creation ,Supernatural/Horror,David F.Sandberg ,"Stephanie Sigman, Talitha Bateman ",2017-08-11,15,110,306.5
429,Van Helsing ,Action/Horror,Stephen Sommers ,"Hugh Jackman, Kate Beckinsale ",2004-05-07,160,131,300.2
430,Resident Evil: Afterlife,Action/Horror,Paul W. S. Anderson ,"Milla Jovovich, Ali Larter ",2010-09-02,60,97,300.2
431,A Quiet Place Part II,Post-Apocalyptic/Horror,John Krasinski ,"Emily Blunt, Cillian Murphy",2021-05-28,55,97,297.4
432,Five Nights at Freddy's ,Supernatural/Horror,Emma Tammi ,"Josh Hutcherson, Elizabeth Lail",2023-10-27,20,109,297.1
433,Split ,Psychological/Thriller,M.Night Shyamalan,"James McAvoy, Anya Taylor-Joy",2017-01-20,9,118,278.5
434,Scary Movie ,Slasher/Parody,Keenen Ivory Wayans ,"Jon Abrahams, Rick Ducommun",2000-07-07,19,88,278
435,The Silence of the Lambs ,Psychological/Horror,Jonathan Demme,"Jodie Foster, Anthony Hopkins",1991-02-14,19,118,272.7
436,The Nun II,Gothic/Supernatural/Horror,Michael Chaves,"Bonnie Aarons, Taissa Farmiga ",2023-09-08,38.5,110,269.5
437,A Quiet Place:Day One ,Apocalyptic/Horror,Michael Sarnoski ,"Lupita Nyong'o, Joseph Quinn",2024-06-28,67,99,261.8
438,Halloween ,Slasher ,David Gordon Green ,"Jamie Lee Curtis, Judy Greer",2018-10-19,10,106,259.9
439,The Village ,Period/Thriller ,M.Night Shyamalan,"Joaquin Phoenix, Adrien Brody ",2004-07-30,60,108,256.7
440,Annabelle,Supernatural/Horror ,John R.Leonetti,"Annabelle Wallis, Ward Horton ",2014-10-03,6.5,99,257.6
441,Us ,Psychological/Horror,Jordan Peele ,"Lupita Nyong'o, Winston Duke",2019-03-22,20,116,256.1
442,Get Out ,Psychological/Horror,Jordan Peele ,"Daniel Kaluuya, Allison Williams",2017-02-24,4.5,104,255.4
443,The Ring ,Supernatural/Horror,Gore Verbinski ,"Naomi Watts, Martin Hederson",2002-10-18,48,115,249.3
444,The Blair Witch Project ,Supernatural/Horror,"Daniel Myrick, Eduardo Sanchez ","Heather Donahue, Michael Williams ",1999-07-14,0.2,81,248.6
445,Dark Shadows ,Gothic/Dark/Fantasy ,Tim Burton ,"Johnny Deep, Michelle Pfeiffer",2012-05-11,150,114,245.5
446,Alien: Covenant ,Sc-Fi/Fiction/Horror,Ridley Scott,"Michael Fassbender, Katherine Waterston ",2017-05-19,97,112,240.9
447,Resident Evil: Retribution ,Action/Horror,Paul W. S. Anderson ,"Milla Jovovich, Michelle Rodriguez",2012-09-26,65,96,240.2
448,Annabelle Comes Home ,Supernatural/Horror,Gary Dauberman ,"Mickenna Grace, Madison Iseman ",2019-06-26,27,106,231.3
449,Constantine ,Superhero/Horror,Francis Lawrence ,"Keanu Reeves, Rachel Weisz",2005-02-18,70,121,230.9
450,Interview with the Vampire ,Gothic/Horror,Neil Jordan,"Tom Cruise, Brad Pitt",1994-11-11,60,122,223.7
451,Scary Movie 3,Parody ,David Zucker,"Anna Faris, Anthony Anderson",2003-10-24,48,84,220.6
452,Dracula Untold ,Action/Horror,Gary Shore ,"Luke Evans, Dominic Cooper",2014-10-10,70,92,217.1
453,Smile,Psychological/Supernatural/Horror,Parker Finn,"Sosie Bacon, Jessie T. Usher",2022-09-30,17,115,217.4
454,Bran Stoker's Dracula ,Gothic/Horror,Francis Ford Coppola ,"Gary Oldman, Winona Ryder ",1992-11-13,40,128,215.9
455,The Others ,Supernatural/Psychological/Horror ,Alejandro Amenabar ,"Nicole Kidman, Fionnula Flanagan",2001-09-07,17,104,210
456,Jaws 2 ,Horror/Thriller,Jeannot Szwarc,"Roy Scheider, Lorraine Gary ",1978-06-16,20,111,208
457,Sleepy Hollow ,Gothic/Supernatural/Horror,Tim Burton ,"Johnny Depp, Christina Ricci ",1999-11-19,70,106,207.1
458,Paranormal Activity 3,Supernatural/Horror,"Hery Joost, Ariel Schulman ","Lauren Bittner, Chris Smith ",2011-10-21,5,84,207
459,The Conjuring: The Devil Made Me Do It ,Supernatural/Horror,Michael Chaves ,"Vera Farmiga, Patrick Wilson",2021-06-04,39,112,206.4
460,Paranormal Activity ,Supernatural/Horror,Oren Peli,"Katie Featherston, Micah Sloat ",2009-09-25,0.2,86,194.2
461,Alien vs. Predator ,Sc-Fi/Action/Horror,Paul W. S. Anderson ,"Sanaa Lathan, Raoul Bova",2004-08-13,60,100,177.4
462,Aliens vs. Predator:Requiem ,Sc-Fi/Horror/Action,The Brothers Strause,"Steven Pasquale, Reiko Aylesworth",2007-12-25,40,94,130.3
463,Alien,Sc-Fi/Horror/Action,Ridley Scott,"Tom Skerritt, Sigourney Weaver",1979-09-06,11,116,187
464,Aliens,Sc-Fi/Horror/Action,James Cameron ,Sigourney Weaver ,1986-07-19,18.5,137,183.3
465,Alien 3,Sc-Fi/Horror/Action,David Fincher ,"Sigourney Weaver, Charles S. Dutton ",1992-05-22,50,114,159.8
466,Alien Resurrection,Sc-Fi/Horror/Action,Jean-Pierre Jeunet ,"Sigourney Weaver, Winona Ryder ",1997-11-26,70,109,161.4
467,Saw,Horror,James Wan ,"Cary Elwes, Danny Glover ",2004-10-29,1.2,103,104
468,Saw II,Horror,Darren Lynn Bousman,"Dannie Wahlberg, Franky G",2005-10-28,4,93,152.9
469,Saw III,Horror,Darren Lynn Bousman,"Tobin Bell, Shawnee Smith",2006-10-27,10,108,164.9
